Date,View,Reply,Repost,Like,Bookmark,Content,URL,Answer,Reason
2024.10.12,31200000,18000,58000,247000,8000,"We are now known, all throughout the world, as OCCUPIED AMERICA...But to everyone here in Colorado and all across our nation, I make you this vow: November 5th, 2024 will be LIBERATION DAY in America. I will rescue Aurora and every town that has been invaded and conquered—and we will put these vicious and bloodthirsty criminals in jail or kick them the hell OUT OF OUR COUNTRY. In honor of Jocelyn Nungaray, Laken Riley, Rachel Morin, and all of the others that are dead and mortally wounded at the hands of migrants who should never have been allowed into our Country, I am announcing today that upon taking office, we will have an OPERATION AURORA at the Federal Level. To expedite removals of this savage gang, I will invoke the Alien Enemies Act of 1798 to target and dismantle every migrant criminal network operating on American Soil. No person who has inflicted the violence and terror that Kamala Harris has inflicted on this community can EVER be allowed to become President of the United States!",https://x.com/realDonaldTrump/status/1844869841087258770,Final Answer: half-true,"while specific incidents involving victims like Jocelyn Nungaray, Laken Riley, and Rachel Morin are accurately linked to individuals in the U.S. illegally, the proposed use of the Alien Enemies Act of 1798 to target all migrant criminal networks is a misapplication of the law's intended scope."
2024.10.11,31400000,11000,42000,228000,4400,"60 Minutes is a major part of the News Organization of CBS, which has just created the Greatest Fraud in Broadcast History. CBS should lose its license, and it should be bid out to the Highest Bidder, as should all other Broadcast Licenses, because they are just as corrupt as CBS—and maybe even WORSE!",https://x.com/realDonaldTrump/status/1844514602467340701,Final Answer: false,"the claim that CBS's 60 Minutes committed the Greatest Fraud in Broadcast History is unsubstantiated, and the suggestion that CBS should lose its broadcast license over this allegation lacks legal foundation."
2024.10.09,24700000,10000,26000,205000,1900,"Very proud of Melania! Her book is out Nationally, and for sale EVERYWHERE. It is really great! She was a fantastic First Lady, and shares that experience, and much more. She's also a really good writer, as she showed at the Republican National Convention with her letter, that turned out to be a sensational highlight. Perfect for Christmas. Get it NOW, and ENJOY!",https://x.com/realDonaldTrump/status/1843749941245530312,Final Answer: mostly-true,"Melania Trump's memoir was released nationally and is available through major retailers. The book shares her experiences as First Lady and more. However, evaluations of her writing skills are subjective and have received mixed reviews."
2024.10.02,26000000,5500,23000,233000,2100,"The GREAT Pete Rose just died. He was one of the most magnificent baseball players ever to play the game. He paid the price! Major League Baseball should have allowed him into the Hall of Fame many years ago. Do it now, before his funeral! DJT",https://x.com/realDonaldTrump/status/1841297685938409858,Final Answer: true,"the statement accurately reflects Pete Rose's death, his baseball achievements, and the consequences he faced, while the opinions on his Hall of Fame induction are subjective."
2024.10.02,90200000,21000,111000,602000,45000,"EVERYONE KNOWS I WOULD NOT SUPPORT A FEDERAL ABORTION BAN, UNDER ANY CIRCUMSTANCES, AND WOULD, IN FACT, VETO IT, BECAUSE IT IS UP TO THE STATES TO DECIDE BASED ON THE WILL OF THEIR VOTERS (THE WILL OF THE PEOPLE!). LIKE RONALD REAGAN BEFORE ME, I FULLY SUPPORT THE THREE EXCEPTIONS FOR RAPE, INCEST, AND THE LIFE OF THE MOTHER. I DO NOT SUPPORT THE DEMOCRATS RADICAL POSITION OF LATE TERM ABORTION LIKE, AS AN EXAMPLE, IN THE 7TH, 8TH, OR 9TH MONTH OR, IN CASE THERE IS ANY QUESTION, THE POSSIBILITY OF EXECUTION OF THE BABY AFTER BIRTH. THANK YOU FOR YOUR ATTENTION TO THIS MATTER!",https://x.com/realDonaldTrump/status/1841295548109955091,Final Answer: half-true,"Trump's claims about his own abortion policies are accurate, but his portrayal of the Democratic Party's position on late-term abortions and post-birth actions is misleading and false."
2024.10.01,19400000,6600,43000,239000,2600,"To every family that has been displaced here in Georgia, in North Carolina, and throughout the region, our hearts are with you in this hour of need. You are in our prayers today, and throughout all the long weeks that lay ahead. We love you—we are with you—and we will be back again and again… https://x.com/teamtrump/stat/TeamTrump/status/1840819094498509257/video/1",https://x.com/realDonaldTrump/status/1840825400148017462,Final Answer: uncertain,"the statement's content aligns with the events following Hurricane Helene, but the provided source link is invalid, preventing verification of its authenticity."
2024.10.01,19000000,10000,40000,208000,3100,"We are now heading to Valdosta, Georgia, in order to pay my respects and bring lots of relief material, including fuel, equipment, water, and other things, to the State. Many politicians and Law Enforcement will be there. We'll be saying hello to Franklin Graham, Burt Jones, Tyler Harper, Mike Collins, Austin Scott, Russ Goodman, Sam Watson, and the Mayor of Valdosta Scott James. They are working very hard. I was also going to stop into North Carolina, which has really been hit hard. I have a lot of supplies ready for them, but access and communication is now restricted, and we want to make sure that Local Emergency Management is able to focus on helping the people most affected, and not being concerned with me. I'll be there shortly, but don't like the reports that I'm getting about the Federal Government, and the Democrat Governor of the State, going out of their way to not help people in Republican areas. MAGA!",https://x.com/realDonaldTrump/status/1840779255786955251,Final Answer: mostly-true,"the statement correctly details the visit to Valdosta and considerations regarding North Carolina, but includes an unsubstantiated claim about partisan aid distribution."
2024.10.01,30200000,11000,19000,105000,8200,"I promised to Make America Great Again, this time with crypto. @WorldLibertyFi is planning to help make America the crypto capital of the world! The whitelist for eligible persons is officially open – this is your chance to be part of this historic moment. Join: https://worldlibertyfinancial.com",https://x.com/realDonaldTrump/status/1840772362209251611,Final Answer: true,"the statement correctly outlines Trump's crypto initiative and the opening of the whitelist for eligible participants, with the provided URL leading to the official website."
2024.09.25,46900000,30000,63000,383000,10000,"Big threats on my life by Iran. The entire U.S. Military is watching and waiting. Moves were already made by Iran that didn't work out, but they will try again. Not a good situation for anyone. I am surrounded by more men, guns, and weapons than I have ever seen before. Thank you to Congress for unanimously approving far more money to Secret Service - Zero “NO” Votes, strictly bipartisan. Nice to see Republicans and Democrats get together on something. An attack on a former President is a Death Wish for the attacker!",https://x.com/realDonaldTrump/status/1838802596066209994,Final Answer: true,"the statement accurately describes the threats from Iran, the U.S. military's vigilance, increased security measures, and the unanimous congressional approval of additional Secret Service funding."
2024.09.25,22500000,11000,43000,222000,3000,"After almost four years, Border Czar Kamala Harris has decided, for political reasons, that it's time for her to go to our broken Southern Border. What a disgrace that she waited so long, allowing millions of people to enter our Country from prisons, mental institutions, and criminal cells all over the World, not just South America, many of those coming are terrorists, and at a level never seen before! She's trying to con the public like she did a good job at the Border when, in fact, she has destroyed the very fabric of our Nation allowing 21 Million people in from places unknown. When Kamala is seen at the Border on Friday, she will pass Hundreds of Miles of Wall that was built by TRUMP, and it is Wall that WORKS! When she speaks, be advised that this woman has allowed more than 21 million people into our Country, totally unvetted, and from places unknown. They are now creating criminal havoc all throughout the Country. Every State is a Border State! When she speaks, I hope everybody remembers that she has caused our cities, towns, and Country itself, tremendous damage, and only I can fix it!",https://x.com/realDonaldTrump/status/1838780123610243192,Final Answer: mostly-false,"the statement combines some factual elements with significant exaggerations and unsupported claims, leading to a misleading portrayal of the situation."
2024.09.18,107200000,11000,40000,276000,1700,Early Voting in Pennsylvania. GO VOTE. MAKE AMERICA GREAT AGAIN!!! DJT,https://x.com/realDonaldTrump/status/1836101995444236619,Final Answer: half-true,"the statement encourages early voting, but the availability of ballots for early voting as of September 18, 2024, varied by county, and not all voters may have been able to cast their ballots at that time."
2024.09.18,50300000,28000,55000,368000,4700,"Your Automobile Insurance is up 73% — VOTE FOR TRUMP, I'LL CUT THAT NUMBER IN HALF!",https://x.com/realDonaldTrump/status/1836100511960818044,Final Answer: mostly-false,the statement exaggerates the increase in auto insurance rates and makes a promise that is beyond the direct control of a president.
2024.09.17,29600000,29000,66000,324000,7500,"The Rhetoric, Lies, as exemplified by the false statements made by Comrade Kamala Harris during the rigged and highly partisan ABC Debate, and all of the ridiculous lawsuits specifically designed to inflict damage on Joe's, then Kamala's, Political Opponent, ME, has taken politics in our Country to a whole new level of Hatred, Abuse, and Distrust. Because of this Communist Left Rhetoric, the bullets are flying, and it will only get worse! Allowing millions of people, from places unknown, to INVADE and take over our Country, is an unpardonable sin. OUR BORDERS MUST BE CLOSED, AND THE TERRORISTS, CRIMINALS, AND MENTALLY INSANE, IMMEDIATELY REMOVED FROM AMERICAN CITIES AND TOWNS, DEPORTED BACK TO THEIR COUNTIES OF ORIGIN. WE WANT PEOPLE TO COME INTO OUR COUNTRY, BUT THEY MUST LOVE OUR NATION, AND COME IN LEGALLY AND THROUGH A SYSTEM OF MERIT. THE WORLD IS LAUGHING AT US AS FOOLS, THEY ARE STEALING OUR JOBS AND OUR WEALTH. WE CANNOT LET THEM LAUGH ANY LONGER. MAKE AMERICA GREAT AGAIN!",https://x.com/realDonaldTrump/status/1835717973069197484,Final Answer: mostly-false,"the statement includes some factual references but is largely composed of exaggerated and unsubstantiated claims, leading to a misleading portrayal of the issues discussed."
2024.09.17,31200000,24000,58000,520000,5500,"I would like to thank everyone for your concern and well wishes - It was certainly an interesting day! Most importantly, I want to thank the U.S. Secret Service, Sheriff Ric Bradshaw and his Office of brave and dedicated Patriots, and, all of Law Enforcement, for the incredible job done today at Trump International in keeping me, as the 45th President of the United States, and the Republican Nominee in the upcoming Presidential Election, SAFE. THE JOB DONE WAS ABSOLUTELY OUTSTANDING. I AM VERY PROUD TO BE AN AMERICAN!",https://x.com/realDonaldTrump/status/1835717567907787035,Final Answer: true,"the statement accurately describes the assassination attempt on September 15, 2024, and the effective response by the U.S. Secret Service and local law enforcement."
2024.09.15,56700000,36000,90000,556000,12000,"As President I will immediately end the migrant invasion of America. We will stop all migrant flights, end all illegal entries, terminate the Kamala phone app for smuggling illegals (CBP One App), revoke deportation immunity, suspend refugee resettlement, and return Kamala's illegal migrants to their home countries (also known as remigration). I will save our cities and towns in Minnesota, Wisconsin, Michigan, Pennsylvania, North Carolina, and all across America. #MAGA2024!",https://x.com/realDonaldTrump/status/1835315698169475316,Final Answer: half-true,the statement presents policy intentions that are partially within the president's authority but includes claims that are exaggerated or would face significant challenges to implement fully.
2024.09.08,32500000,28000,68000,280000,10000,"CEASE & DESIST: I, together with many Attorneys and Legal Scholars, am watching the Sanctity of the 2024 Presidential Election very closely because I know, better than most, the rampant Cheating and Skullduggery that has taken place by the Democrats in the 2020 Presidential Election. It was a Disgrace to our Nation! Therefore, the 2024 Election, where Votes have just started being cast, will be under the closest professional scrutiny and, WHEN I WIN, those people that CHEATED will be prosecuted to the fullest extent of the Law, which will include long term prison sentences so that this Depravity of Justice does not happen again. We cannot let our Country further devolve into a Third World Nation, AND WE WON'T! Please beware that this legal exposure extends to Lawyers, Political Operatives, Donors, Illegal Voters, & Corrupt Election Officials. Those involved in unscrupulous behavior will be sought out, caught, and prosecuted at levels, unfortunately, never seen before in our Country.",https://x.com/realDonaldTrump/status/1832589096029450360,Final Answer: mostly-false,"the statement repeats debunked claims about the 2020 election and issues broad warnings about the 2024 election without providing specific evidence, leading to a misleading portrayal of election integrity issues."
2024.09.02,24900000,16000,55000,277000,4100,"We grieve the senseless death of the Israeli Hostages, horrifically including a wonderful American Citizen, Hersh Goldberg-Polin, murdered by Hamas due to a complete lack of American Strength and Leadership. Make no mistake — This happened because Comrade Kamala Harris and Crooked Joe Biden are poor Leaders. Americans are getting slaughtered overseas, while Kamala is disparaging and making up lies about Gold Star families, and Biden is sleeping on the beach on this 16th consecutive day of vacation. They have blood on their hands! Sadly, this is the total lack of “Leadership” that Kamala and Biden represent — One that allows terrorists to take American lives, because they only care about Weaponizing the Department of Justice against their Political Opponent. Just like the Debacle of the Afghanistan Withdrawal that claimed 13 American lives, Kamala and Biden's judgment has not only put lives at risk, but is directly responsible for unnecessary deaths that should have never happened.   Our Country and our amazing people are not safe under Joe Biden, and will be less safe under Kamala Harris. This terror would have never happened if I were President, and it will stop the day I am back in the Oval Office. America will be Strong Again, and that will make the World Safe and Secure!",https://x.com/realDonaldTrump/status/1830335021187490133,Final Answer: mostly-false,"while the death of Hersh Goldberg-Polin is a confirmed and tragic event, attributing his death to the alleged failures of U.S. leadership under Biden and Harris is unsubstantiated, and claims about their inaction or misplaced priorities lack credible evidence."
2024.08.31,26300000,21000,51000,287000,3400,"Kamala Harris is the Weakest Presidential Candidate in History on Crime. She's allowed millions of people to pour through our Borders, many from prisons, mental institutions and, indeed, terrorists, coming in at levels never seen before. What gives her the right to run for President? She got no votes to Biden's 14 Million. She failed in her previous attempt, was the first one out of 22 people to quit, never made it to Iowa, and now she's a Presidential Candidate? This is a Threat to Democracy!",https://x.com/realDonaldTrump/status/1829835836268929277,Final Answer: mostly-false,the statement includes some factual elements regarding Harris's previous campaign but largely consists of exaggerated or unsubstantiated claims about her record and candidacy.
2024.08.31,14400000,7800,25000,149000,1500,"Think of it, America, Pocahontas, sometimes referred to as Elizabeth Warren, is considered far more Conservative in the U.S. Senate than Comrade Kamala Harris ever was. Is this really what we want to be President of the United States? She will only bring us Poverty, Chaos, and Heartache! Kamala is rated, by far, the Number One Most Liberal Senator.",https://x.com/realDonaldTrump/status/1829834705325170977,Final Answer: half-true,"while it's correct that Kamala Harris was ranked as the most liberal senator in 2019, the claim that Elizabeth Warren is considered far more conservative than Harris lacks substantiating evidence."
2024.08.31,23300000,16000,44000,312000,3300,"I look so forward to Debating Comrade Kamala Harris and exposing her for the fraud she is. Harris has changed every one of her long held positions, on everything. America will never allow an Election WEAPONIZING MARXIST TO BE PRESIDENT OF THE U.S.",https://x.com/realDonaldTrump/status/1829745502440587304,Final Answer: mostly-false,the statement correctly notes Harris's changes in policy positions but falsely labels her as a Marxist and uses Comrade without substantiation.
2024.08.28,30300000,17000,40000,282000,2400,PERSECUTION OF A POLITICAL OPPONENT!,https://x.com/realDonaldTrump/status/1828807702090330238,Final Answer: uncertain,"the claim of political persecution is subjective and lacks concrete evidence, making it difficult to definitively assess its truthfulness."
2024.08.28,19400000,14000,53000,234000,3600,"It is DOJ policy that the Department of Justice should not take any action that will influence an election within 60 days of that election – but they just have taken such action. Voting starts on September 6th, therefore the DOJ has violated its own policy – Election Interference. All of these Comrade Kamala/Biden Hoaxes should be immediately DISMISSED!",https://x.com/realDonaldTrump/status/1828625060187218292,Final Answer: false,the DOJ's actions were consistent with its responsibilities to protect election integrity and did not violate any formal policy or constitute election interference.
2024.08.26,9600000,6900,32000,175000,1200,"Kamala Harris was the leader of BANNING FRACKING IN THE UNITED STATES, and fought especially hard for No Fracking in Pennsylvania. The people of Pennsylvania are smart. She would devastate the Commonwealth, and they know it. They will VOTE FOR TRUMP!",https://x.com/realDonaldTrump/status/1827859473735827683,Final Answer: mostly-false,Harris previously supported a fracking ban but changed her position by 2024; the claim doesn't account for this shift and overstates her influence on state-specific fracking policies.
2024.08.26,12800000,11000,46000,243000,2600,"If you think things are expensive now, they will get 100 times WORSE if Kamala gets four years as President. Under her plan, Kamala will implement SOVIET Style Price Controls. She will abolish private health care, and make California's ridiculous tax policies the law of the land, meaning EVERY American will be taxed up to 80% of their income! If you want more CASH and less TAX, VOTE TRUMP!!!",https://x.com/realDonaldTrump/status/1827796042760560764,Final Answer: false,the claims about Kamala Harris's economic policies are exaggerated and not supported by her actual proposals.
2024.08.26,9400000,7900,37000,195000,1300,Comrade Kamala will obliterate Social Security and Medicare by giving it away to the Millions of Illegal Immigrants who are infiltrating our Country!,https://x.com/realDonaldTrump/status/1827785056498171950,Final Answer: false,the claim misrepresents Harris's policy positions and overlooks existing legal restrictions on benefit eligibility.
2024.08.26,13300000,10000,32000,212000,1700,"There will be no future under Comrade Kamala Harris, because she will take us into a Nuclear World War III! She will never be respected by the Tyrants of the World!",https://x.com/realDonaldTrump/status/1827784751312142496,Final Answer: false,the assertion is speculative and not substantiated by Harris's foreign policy experience or positions.
2024.08.26,12200000,9900,65000,357000,2800,"Kamala and her “handlers” are trying to make it sound like I am the Incumbent President, so that they can blame me for the failure of the past four years. No, it was their failure! It is one of the worst Presidencies in History, and she is definitely the Worst Vice President.",https://x.com/realDonaldTrump/status/1827784510249046393,Final Answer: false,the claims are subjective and lack supporting evidence.
2024.08.26,38600000,22000,65000,441000,4200,NOVEMBER 5TH WILL BE THE MOST IMPORTANT DAY IN THE HISTORY OF AMERICA!,https://x.com/realDonaldTrump/status/1827739726629024026,Final Answer: uncertain,"the importance of November 5, 2024, is subjective and cannot be definitively assessed."
2024.08.26,31700000,16000,70000,410000,82000,"Who is negotiating for us in the Middle East? Bombs are dropping all over the place! Sleepy Joe is sleeping on a Beach in California, viciously Exiled by the Democrats, and Comrade Kamala is doing a campaign bus tour with Tampon Tim, her really bad V.P. Pick. Let's not have World War lll, because that's where we're heading!",https://x.com/realDonaldTrump/status/1827737056186954201,Final Answer: false,the statement contains factual elements but is exaggerated and lacks supporting evidence for its more extreme claims.
2024.08.23,10400000,10000,21000,137000,1200,"Thank you to @BrianKempGA for all of your help and support in Georgia, where a win is so important to the success of our Party and, most importantly, our Country.  I look forward to working with you, your team, and all of my friends in Georgia to help MAKE AMERICA GREAT AGAIN!",https://x.com/realDonaldTrump/status/1826800523280040166,Final Answer: true,"the statement accurately reflects Governor Kemp's support and the collaborative efforts between him and Donald Trump in Georgia as of August 23, 2024."
2024.08.23,11600000,14000,61000,279000,3800,"At the Democrat Convention, they said, “We've got 70 days to act right…After 70 days, we can go back to acting crazy!” What they mean is that they want to get Elected, and then destroy our Country with Radical Left, Marxist/Socialist Policies. We can't let this happen and, if it does, we won't have a Country any longer. The U.S.A. will be reduced to ashes. #MAGA2024!",https://x.com/realDonaldTrump/status/1826736315590918654,Final Answer: false,the statement misinterprets a colloquial remark and lacks evidence to support claims of impending radical policy implementations by the Democratic Party.
2024.08.13,45300000,58000,141000,794000,11000,Are you better off now than you were when I was president? Our economy is shattered. Our border has been erased. We're a nation in decline. Make the American Dream AFFORDABLE again. Make America SAFE again. Make America GREAT Again!,https://x.com/realDonaldTrump/status/1823034723867713700,Final Answer: mostly-false,"the statement exaggerates the current state of the economy and border security, though some concerns have a basis in reality."
